{
  "schemaVersion": 0,
  "id": "effect.fire.flame",
  "name": "Fire Flame",
  "description": "Looping flame emitter for burning objects.",
  "spawn": {
    "ratePerSecond": 24.0,
    "maxParticles": 96
  },
  "lifetimeSeconds": {
    "min": 0.35,
    "max": 0.8
  },
  "velocity": {
    "x": {
      "min": -0.15,
      "max": 0.15
    },
    "y": {
      "min": -1.4,
      "max": -0.5
    },
    "z": {
      "min": 0.0,
      "max": 0.0
    }
  },
  "colorOverLifetime": [
    {
      "time": 0.0,
      "color": {
        "red": 1.0,
        "green": 0.74,
        "blue": 0.2,
        "alpha": 0.95
      }
    },
    {
      "time": 0.5,
      "color": {
        "red": 1.0,
        "green": 0.22,
        "blue": 0.05,
        "alpha": 0.75
      }
    },
    {
      "time": 1.0,
      "color": {
        "red": 0.25,
        "green": 0.05,
        "blue": 0.02,
        "alpha": 0.0
      }
    }
  ],
  "sizeOverLifetime": [
    {
      "time": 0.0,
      "size": 0.35
    },
    {
      "time": 0.45,
      "size": 0.75
    },
    {
      "time": 1.0,
      "size": 0.15
    }
  ],
  "acceleration": {
    "gravity": {
      "x": 0.0,
      "y": -0.2,
      "z": 0.0
    },
    "drift": {
      "x": 0.1,
      "y": 0.0,
      "z": 0.0
    }
  },
  "blendMode": "additive",
  "emissionMode": {
    "kind": "looping"
  },
  "attachment": {
    "kind": "attachmentPoint",
    "data": {
      "entityId": "entity.sign.welcome",
      "attachmentPointId": "origin"
    }
  },
  "tags": ["fire", "looping"]
}
